{
  "id": "org.apache.spark.ml.ibm.transformers.Sample",
  "version": "1.0",
  "icon": "images/transformationspark.svg",
  "label": {
    "default": "Sample Rows"
  },
  "description": {
    "default": "Perform a simple sample operation on the data, with or without replacement"
  },
  "parameter_info": [
    {
      "parameter_ref": "withReplacement",
      "label": {
        "default": "Sample"
      },
      "description": {
        "default": "Indicate that sampling be performed with replacement"
      },
      "control": "radioset",
      "resource_key": "withReplace"
    },
    {
      "parameter_ref": "samplingRatio",
      "label": {
        "default": "Sample Ratio"
      },
      "description": {
        "default": "Fraction of rows to include in sample"
      }
    },
    {
      "parameter_ref": "samplingSize",
      "label": {
        "default": "Maximum sample size"
      },
      "description": {
        "default": "Maximum number of rows in the sample"
      }
    },
    {
      "parameter_ref": "samplingSeed",
      "label": {
        "default": "Seed"
      },
      "description": {
        "default": "Seed for the sample random number generator"
      },
      "number_generator": {
        "label": {
          "default": "Generate",
          "resource_key": "numberGenerator"
        },
        "range": {
          "min": 1000000,
          "max": 9999999
        }
      }
    }
  ],
  "group_info": [
    {
      "id": "settings",
      "label": {
        "default": "Settings"
      },
      "type": "panels",
      "group_info": [
        {
          "id": "basic-settings",
          "type": "controls",
          "parameter_refs": [
            "withReplacement",
            "samplingRatio"
          ]
        },
        {
          "id": "sample-size",
          "type": "checkboxPanel",
          "label": {
            "default": "Use maximum sample size"
          },
          "parameter_refs": [
            "samplingSize"
          ]
        },
        {
          "id": "sample-seed",
          "type": "checkboxPanel",
          "label": {
            "default": "Repeatable partition assignment"
          },
          "parameter_refs": [
            "samplingSeed"
          ]
        }
      ]
    }
  ]
}
